{
  "schemaVersion": "0.1.0",
  "projectId": "project_001",
  "slug": "mystery-garden",
  "displayName": "Mystery Garden Replay Slice",
  "gameFamily": "slot",
  "implementationScope": "slot-first",
  "phase": "PHASE 5D",
  "status": "validated",
  "verification": {
    "status": "verified-replay-slice",
    "checks": [
      "validate:workspace",
      "smoke:edit-project",
      "smoke:drag-edit",
      "smoke:duplicate-delete",
      "smoke:create-object",
      "import:mystery-garden",
      "validate:project_001",
      "assert:replay"
    ],
    "lastVerifiedAt": "2026-03-20T19:10:45Z",
    "notes": "Internal replay slice plus the bounded editor loop are verified, including create placeholder object, drag/nudge, duplicate/delete, undo/redo, save/reload, and deterministic replay sync; live restart and free-spins capture gaps remain."
  },
  "lifecycle": {
    "currentStage": "internalReplay",
    "stages": {
      "donorEvidence": {
        "status": "verified",
        "notes": "Official Mystery Garden evidence pack exists and is indexed."
      },
      "donorReport": {
        "status": "verified",
        "notes": "Evidence-backed donor report and maps exist."
      },
      "importMapping": {
        "status": "verified",
        "notes": "Mystery Garden importer manifest and mapping path exist."
      },
      "internalReplay": {
        "status": "verified",
        "notes": "Validated internal replay slice exists in project_001, now with a bounded editable shell workflow that can create, move, edit, duplicate, delete, save, reload, and sync."
      },
      "targetConcept": {
        "status": "planned",
        "notes": "A resulting game concept exists only as a future path."
      },
      "targetBuild": {
        "status": "deferred",
        "notes": "No resulting game build is started yet."
      },
      "integration": {
        "status": "deferred",
        "notes": "Production adapter work is not started yet."
      },
      "qa": {
        "status": "planned",
        "notes": "Workspace and replay verification exist; broader QA remains future work."
      },
      "releasePrep": {
        "status": "deferred",
        "notes": "Release preparation is not started yet."
      }
    }
  },
  "paths": {
    "projectRoot": "40_projects/project_001",
    "projectJson": "40_projects/project_001/project.json",
    "metaPath": "40_projects/project_001/project.meta.json",
    "registryPath": "40_projects/registry.json",
    "evidenceRoot": "10_donors/donor_001_mystery_garden/evidence",
    "donorRoot": "40_projects/project_001/donor",
    "reportsRoot": "40_projects/project_001/reports",
    "importsRoot": "40_projects/project_001/imports",
    "internalRoot": "40_projects/project_001/internal",
    "importPath": "40_projects/project_001/imports/mystery-garden-import.json",
    "runtimeRoot": "40_projects/project_001/runtime",
    "fixturesRoot": "40_projects/project_001/fixtures",
    "targetRoot": "40_projects/project_001/target",
    "releaseRoot": "40_projects/project_001/release",
    "logsRoot": "40_projects/project_001/logs"
  },
  "donor": {
    "donorId": "donor_001_mystery_garden",
    "donorName": "Mystery Garden",
    "evidenceRoot": "10_donors/donor_001_mystery_garden/evidence",
    "captureSessions": [
      "MG-CS-20260320-WEB-A",
      "MG-CS-20260320-LIVE-A"
    ],
    "evidenceRefs": [
      "MG-EV-20260320-WEB-A-001",
      "MG-EV-20260320-WEB-A-002",
      "MG-EV-20260320-WEB-A-003",
      "MG-EV-20260320-WEB-A-004",
      "MG-EV-20260320-WEB-A-005",
      "MG-EV-20260320-WEB-A-006",
      "MG-EV-20260320-WEB-A-007",
      "MG-EV-20260320-WEB-A-008",
      "MG-EV-20260320-LIVE-A-001",
      "MG-EV-20260320-LIVE-A-002",
      "MG-EV-20260320-LIVE-A-003",
      "MG-EV-20260320-LIVE-A-004",
      "MG-EV-20260320-LIVE-A-005",
      "MG-EV-20260320-LIVE-A-006"
    ],
    "status": "proven",
    "notes": "Only validated donor slice in the current workspace."
  },
  "targetGame": {
    "targetGameId": "target.mystery-garden.replay-slice",
    "displayName": "Mystery Garden Replay Slice",
    "gameFamily": "slot",
    "relationship": "reconstruction-target",
    "status": "validated",
    "provenNotes": [
      "Internal replay runs from clean project data only.",
      "The donor-to-replay path is verified without production integration."
    ],
    "plannedNotes": [
      "Future reskinning is deferred.",
      "Additional donor slices may be added later."
    ],
    "notes": "Validated internal slice only; not the final resulting game."
  },
  "timestamps": {
    "createdAt": "2026-03-20T00:00:00Z",
    "updatedAt": "2026-03-20T19:10:45Z",
    "firstValidatedAt": "2026-03-20T10:32:56Z"
  },
  "notes": {
    "provenFacts": [
      "Replay loader uses internal project data only.",
      "Project_001 is the only validated donor-backed project so far.",
      "The shell can now create, edit, move, duplicate, delete, and persist bounded scene objects from project_001 internal scene files.",
      "Save deterministically syncs the replay-facing generated project.json output from the editable internal scene files."
    ],
    "plannedWork": [
      "Keep donor links and target game metadata explicit for every project.",
      "Maintain the standard folder-based project lifecycle alongside the validated replay slice.",
      "Expand the editor slice carefully without jumping into a full drag/drop editor."
    ],
    "assumptions": [
      "This metadata file is the shell-facing project summary until a richer workspace state file exists.",
      "The current bounded editor slice remains intentionally small enough to stay reliable without advanced gizmos or a full asset-creation workflow yet."
    ],
    "unresolvedQuestions": [
      "How quickly the project registry will grow beyond a single validated entry.",
      "Which next productivity upgrade should come before broader scene editing."
    ]
  }
}
